kernels/moe_tuned/E=256,N=128,device_name=NVIDIA_GH200_120GB.json
{
  "triton_version": "3.6.0",
  "64": {
    "BLOCK_SIZE_M": 16,
    "BLOCK_SIZE_N": 64,
    "BLOCK_SIZE_K": 64,
    "GROUP_SIZE_M": 32,
    "num_warps": 4,
    "num_stages": 3
  },
  "128": {
    "BLOCK_SIZE_M": 16,
    "BLOCK_SIZE_N": 128,
    "BLOCK_SIZE_K": 64,
    "GROUP_SIZE_M": 64,
    "num_warps": 8,
    "num_stages": 3
  },
  "192": {
    "BLOCK_SIZE_M": 16,
    "BLOCK_SIZE_N": 64,
    "BLOCK_SIZE_K": 64,
    "GROUP_SIZE_M": 64,
    "num_warps": 4,
    "num_stages": 3
  },
  "256": {
    "BLOCK_SIZE_M": 16,
    "BLOCK_SIZE_N": 64,
    "BLOCK_SIZE_K": 64,
    "GROUP_SIZE_M": 16,
    "num_warps": 4,
    "num_stages": 3
  },
  "512": {
    "BLOCK_SIZE_M": 32,
    "BLOCK_SIZE_N": 64,
    "BLOCK_SIZE_K": 64,
    "GROUP_SIZE_M": 16,
    "num_warps": 4,
    "num_stages": 3
  },
  "1024": {
    "BLOCK_SIZE_M": 64,
    "BLOCK_SIZE_N": 128,
    "BLOCK_SIZE_K": 64,
    "GROUP_SIZE_M": 32,
    "num_warps": 4,
    "num_stages": 2
  },
  "4096": {
    "BLOCK_SIZE_M": 128,
    "BLOCK_SIZE_N": 256,
    "BLOCK_SIZE_K": 64,
    "GROUP_SIZE_M": 32,
    "num_warps": 8,
    "num_stages": 4
  },
  "16384": {
    "BLOCK_SIZE_M": 128,
    "BLOCK_SIZE_N": 256,
    "BLOCK_SIZE_K": 64,
    "GROUP_SIZE_M": 32,
    "num_warps": 8,
    "num_stages": 4
  }
}